{
  "claim_boundary": "no_conformance_claim",
  "kind": "proofrail.esrm.binary-vector-manifest.v0.1",
  "schema_version": "esrm.v0.1",
  "vector_set_id": "esrm-vectors-raw-byte-lab-v0.1",
  "vectors": [
    {
      "ambiguity_ids": [],
      "artifact_type": "proofrail.binary_vector_manifest",
      "domain": "proofrail.esrm.raw_byte_lab",
      "expected_reason_code": "schema_required_missing",
      "expected_stage": "schema_validation",
      "raw_byte_length": 0,
      "requirement_ids": [
        "ESRM-LP-23-MUST-001"
      ],
      "sha256": "0000000000000000000000000000000000000000000000000000000000000000",
      "status": "planned",
      "vector_id": "ESRM-VEC-001"
    },
    {
      "ambiguity_ids": [],
      "artifact_type": "proofrail.binary_vector_manifest",
      "domain": "proofrail.esrm.raw_byte_lab",
      "expected_reason_code": "schema_required_missing",
      "expected_stage": "schema_validation",
      "raw_byte_length": 0,
      "requirement_ids": [
        "ESRM-LP-23-MUST-002"
      ],
      "sha256": "0000000000000000000000000000000000000000000000000000000000000000",
      "status": "planned",
      "vector_id": "ESRM-VEC-002"
    },
    {
      "ambiguity_ids": [],
      "artifact_type": "proofrail.binary_vector_manifest",
      "domain": "proofrail.esrm.raw_byte_lab",
      "expected_reason_code": "schema_required_missing",
      "expected_stage": "schema_validation",
      "raw_byte_length": 0,
      "requirement_ids": [
        "ESRM-LP-23-MUST-NOT-001"
      ],
      "sha256": "0000000000000000000000000000000000000000000000000000000000000000",
      "status": "planned",
      "vector_id": "ESRM-VEC-003"
    },
    {
      "ambiguity_ids": [],
      "artifact_type": "proofrail.binary_vector_manifest",
      "domain": "proofrail.esrm.raw_byte_lab",
      "expected_reason_code": "schema_required_missing",
      "expected_stage": "schema_validation",
      "raw_byte_length": 0,
      "requirement_ids": [
        "ESRM-LP-23-MUST-NOT-002"
      ],
      "sha256": "0000000000000000000000000000000000000000000000000000000000000000",
      "status": "planned",
      "vector_id": "ESRM-VEC-004"
    },
    {
      "ambiguity_ids": [],
      "artifact_type": "proofrail.binary_vector_manifest",
      "domain": "proofrail.esrm.raw_byte_lab",
      "expected_reason_code": "schema_required_missing",
      "expected_stage": "schema_validation",
      "raw_byte_length": 0,
      "requirement_ids": [
        "ESRM-LP-24-MUST-001"
      ],
      "sha256": "0000000000000000000000000000000000000000000000000000000000000000",
      "status": "planned",
      "vector_id": "ESRM-VEC-005"
    },
    {
      "ambiguity_ids": [],
      "artifact_type": "proofrail.binary_vector_manifest",
      "domain": "proofrail.esrm.raw_byte_lab",
      "expected_reason_code": "schema_required_missing",
      "expected_stage": "schema_validation",
      "raw_byte_length": 0,
      "requirement_ids": [
        "ESRM-LP-24-MUST-002"
      ],
      "sha256": "0000000000000000000000000000000000000000000000000000000000000000",
      "status": "planned",
      "vector_id": "ESRM-VEC-006"
    },
    {
      "ambiguity_ids": [],
      "artifact_type": "proofrail.binary_vector_manifest",
      "domain": "proofrail.esrm.raw_byte_lab",
      "expected_reason_code": "schema_required_missing",
      "expected_stage": "schema_validation",
      "raw_byte_length": 0,
      "requirement_ids": [
        "ESRM-LP-24-MUST-NOT-001"
      ],
      "sha256": "0000000000000000000000000000000000000000000000000000000000000000",
      "status": "planned",
      "vector_id": "ESRM-VEC-007"
    },
    {
      "ambiguity_ids": [],
      "artifact_type": "proofrail.binary_vector_manifest",
      "domain": "proofrail.esrm.raw_byte_lab",
      "expected_reason_code": "schema_required_missing",
      "expected_stage": "schema_validation",
      "raw_byte_length": 0,
      "requirement_ids": [
        "ESRM-LP-24-MUST-NOT-002"
      ],
      "sha256": "0000000000000000000000000000000000000000000000000000000000000000",
      "status": "planned",
      "vector_id": "ESRM-VEC-008"
    },
    {
      "ambiguity_ids": [],
      "artifact_type": "proofrail.binary_vector_manifest",
      "domain": "proofrail.esrm.raw_byte_lab",
      "expected_reason_code": "schema_required_missing",
      "expected_stage": "schema_validation",
      "raw_byte_length": 0,
      "requirement_ids": [
        "ESRM-LP-25-MUST-001"
      ],
      "sha256": "0000000000000000000000000000000000000000000000000000000000000000",
      "status": "planned",
      "vector_id": "ESRM-VEC-009"
    },
    {
      "ambiguity_ids": [],
      "artifact_type": "proofrail.binary_vector_manifest",
      "domain": "proofrail.esrm.raw_byte_lab",
      "expected_reason_code": "schema_required_missing",
      "expected_stage": "schema_validation",
      "raw_byte_length": 0,
      "requirement_ids": [
        "ESRM-LP-25-MUST-002"
      ],
      "sha256": "0000000000000000000000000000000000000000000000000000000000000000",
      "status": "planned",
      "vector_id": "ESRM-VEC-010"
    },
    {
      "ambiguity_ids": [],
      "artifact_type": "proofrail.binary_vector_manifest",
      "domain": "proofrail.esrm.raw_byte_lab",
      "expected_reason_code": "schema_required_missing",
      "expected_stage": "schema_validation",
      "raw_byte_length": 0,
      "requirement_ids": [
        "ESRM-LP-25-MUST-003"
      ],
      "sha256": "0000000000000000000000000000000000000000000000000000000000000000",
      "status": "planned",
      "vector_id": "ESRM-VEC-011"
    },
    {
      "ambiguity_ids": [],
      "artifact_type": "proofrail.binary_vector_manifest",
      "domain": "proofrail.esrm.raw_byte_lab",
      "expected_reason_code": "schema_required_missing",
      "expected_stage": "schema_validation",
      "raw_byte_length": 0,
      "requirement_ids": [
        "ESRM-LP-25-MUST-NOT-001"
      ],
      "sha256": "0000000000000000000000000000000000000000000000000000000000000000",
      "status": "planned",
      "vector_id": "ESRM-VEC-012"
    },
    {
      "ambiguity_ids": [],
      "artifact_type": "proofrail.binary_vector_manifest",
      "domain": "proofrail.esrm.raw_byte_lab",
      "expected_reason_code": "schema_required_missing",
      "expected_stage": "schema_validation",
      "raw_byte_length": 0,
      "requirement_ids": [
        "ESRM-LP-25-MUST-NOT-002"
      ],
      "sha256": "0000000000000000000000000000000000000000000000000000000000000000",
      "status": "planned",
      "vector_id": "ESRM-VEC-013"
    },
    {
      "ambiguity_ids": [],
      "artifact_type": "proofrail.transition",
      "domain": "proofrail.esrm.raw_byte_lab",
      "expected_reason_code": "schema_required_missing",
      "expected_stage": "schema_validation",
      "raw_byte_length": 0,
      "requirement_ids": [
        "ESRM-LP-26-MUST-001"
      ],
      "sha256": "0000000000000000000000000000000000000000000000000000000000000000",
      "status": "planned",
      "vector_id": "ESRM-VEC-014"
    },
    {
      "ambiguity_ids": [],
      "artifact_type": "proofrail.transition",
      "domain": "proofrail.esrm.raw_byte_lab",
      "expected_reason_code": "schema_required_missing",
      "expected_stage": "schema_validation",
      "raw_byte_length": 0,
      "requirement_ids": [
        "ESRM-LP-26-MUST-002"
      ],
      "sha256": "0000000000000000000000000000000000000000000000000000000000000000",
      "status": "planned",
      "vector_id": "ESRM-VEC-015"
    },
    {
      "ambiguity_ids": [],
      "artifact_type": "proofrail.transition",
      "domain": "proofrail.esrm.raw_byte_lab",
      "expected_reason_code": "schema_required_missing",
      "expected_stage": "schema_validation",
      "raw_byte_length": 0,
      "requirement_ids": [
        "ESRM-LP-26-MUST-003"
      ],
      "sha256": "0000000000000000000000000000000000000000000000000000000000000000",
      "status": "planned",
      "vector_id": "ESRM-VEC-016"
    },
    {
      "ambiguity_ids": [],
      "artifact_type": "proofrail.transition",
      "domain": "proofrail.esrm.raw_byte_lab",
      "expected_reason_code": "schema_required_missing",
      "expected_stage": "schema_validation",
      "raw_byte_length": 0,
      "requirement_ids": [
        "ESRM-LP-26-MUST-NOT-001"
      ],
      "sha256": "0000000000000000000000000000000000000000000000000000000000000000",
      "status": "planned",
      "vector_id": "ESRM-VEC-017"
    },
    {
      "ambiguity_ids": [],
      "artifact_type": "proofrail.transition",
      "domain": "proofrail.esrm.raw_byte_lab",
      "expected_reason_code": "schema_required_missing",
      "expected_stage": "schema_validation",
      "raw_byte_length": 0,
      "requirement_ids": [
        "ESRM-LP-26-MUST-NOT-002"
      ],
      "sha256": "0000000000000000000000000000000000000000000000000000000000000000",
      "status": "planned",
      "vector_id": "ESRM-VEC-018"
    },
    {
      "ambiguity_ids": [],
      "artifact_type": "proofrail.signature",
      "domain": "proofrail.esrm.raw_byte_lab",
      "expected_reason_code": "schema_required_missing",
      "expected_stage": "schema_validation",
      "raw_byte_length": 0,
      "requirement_ids": [
        "ESRM-LP-27-MUST-001"
      ],
      "sha256": "0000000000000000000000000000000000000000000000000000000000000000",
      "status": "planned",
      "vector_id": "ESRM-VEC-019"
    },
    {
      "ambiguity_ids": [],
      "artifact_type": "proofrail.signature",
      "domain": "proofrail.esrm.raw_byte_lab",
      "expected_reason_code": "schema_required_missing",
      "expected_stage": "schema_validation",
      "raw_byte_length": 0,
      "requirement_ids": [
        "ESRM-LP-27-MUST-002"
      ],
      "sha256": "0000000000000000000000000000000000000000000000000000000000000000",
      "status": "planned",
      "vector_id": "ESRM-VEC-020"
    },
    {
      "ambiguity_ids": [],
      "artifact_type": "proofrail.signature",